,phrase,polarity
4913,do not make a great movie,negative
7267,"It was very popular when I was in the cinema, a good house and very good reactions and plenty of laughs.  ",positive
5731,christopher nolan presents a science fiction thriller that has never been seen before.,neutral
3502,did it again.,positive
2976,lol,positive
1973,whole theme and subject matter suggests that some movie could have come out of this,negative
4581,thomas keneally's schindler's ark,neutral
5546,great use of lighting,positive
4569,repeat his performance in the batman,neutral
210,one of the best films i have seen in recent years,positive
2256,goes beyond the embodiment of a nazi,neutral
7400,"first of all, there are enough racial stereotypes and racial jokes to offend everyone.  ",negative
6760,wowp.s do not watch it near a speaker,neutral
534,the personification of evil,positive
1424,odd looking vehicles that the gear heads will love,positive
5024,hands down the best directed film i have ever seen,positive
6679,acting amazing,positive
5732,very little story,negative
3109,perfect for any movie lover,positive
3103,dominant warrior heroine,neutral
4388,the driving force behind him,positive
401,add three of the greatest film performances ever.,positive
5222,water will never be gone from this planet,neutral
5863,to know well,neutral
3691,never mind,neutral
3519,amongst the finest movies of all time,positive
1459,brings nonstop action with the perfect mix of world building,positive
4605,does it again.,neutral
7115,The dialogue sucked.  ,negative
7350,"This movie was kind of long in length, but I enjoyed every minute of it.  ",positive
2423,grunting,negative
458,without question the most impressive movie i've ever seen,positive
4076,this is a masterpiece that rivals the likes of beethoven and shakespeare,positive
2968,strangely in the middle of a video game,neutral
6649,engages it's audience with every adrenaline infused sequence,positive
3755,execution is great,positive
448,great flow and some excellent performances,positive
2819,overly sentimental,negative
5727,it took a lot from the dark knight & interstellar,neutral
5045,took the cake,neutral
6288,great as well very subtle,positive
3460,impressive practical effects and remarkable stunt work,positive
358,brilliants of film,positive
500,ready to make his fortune from the new world war,neutral
6303,asleep or lipreading,negative
5523,enigmatic,positive
6549,thinking that it was there fault was wrong,neutral
6844,shines above all,positive
7426,The movie is terribly boring in places.  ,negative
1593,the storyline is ridiculous,negative
6566,very seductive,positive
1624,branagh,neutral
2701,visual effects and cinematography,neutral
686,tom hardy and charlize have played their role well,positive
1270,one of those films that i feel i've been sold a pup,positive
2536,the best film of the 1990's,positive
4635,"a prodigy of the ""cinema""",positive
471,plain and boring,negative
5857,they never stuck with me like some other action flicks,neutral
5610,great costumes,positive
3277,"gripping atmosphere, a break neck speed pace",positive
1284,very gripped,positive
2707,compelling score by john williams,positive
1289,"a ""film",neutral
6792,unstintingly sentimental and heavy-handedly manipulative,negative
3512,a good (nearly silent) second lead,positive
6936,"Often the dialogue doesn't really follow from one line to another, or fit the surroundings.  ",negative
5153,the acting was sub par,negative
1847,awesome matching up,positive
2713,"2 hour long chase scene gets old rather quickly, even with good special effects",negative
1800,sarcastically killing jews in his camp,neutral
3610,after a long wait,neutral
998,extremely astonishing,positive
6874,Loved the casting of Jimmy Buffet as the science teacher.  ,positive
2205,one mans meat is another mans potatoes,neutral
2528,"read the book ""night""",neutral
7665,"In fact, this stinker smells like a direct-to-video release.  ",negative
3853,put them in a nice action packed chase scene,positive
7630,"Personally, I think it shows that people should learn to find a compromise them self without involving other people into issue.  ",positive
2201,uses a parallel montage,neutral
1474,this is just 2 hours of action show,negative
1745,curiosity,neutral
6219,toads rose up to lead as humans,neutral
1702,the culprit is the movie,negative
7360,"And I forgot: The Casting here i superb, with Trond Fausa AurvÃ¥g being perfect in the role as the Bothersome Man, who doesn't understand where he is, what he is doing and why.  ",positive
5736,because of the style,neutral
3825,melodramatically lamenting his inability to do more,negative
2449,retreat that he made on the darkest period,neutral
1924,terrific,positive
4597,so perhaps there would be potential,neutral
3013,good effort to make it real,positive
4788,makes endgame's own concept of time travel seem rudimentary,negative
3633,it stays very close,positive
4346,there is not a duff performance throughout this film.,neutral
6637,it'll open the right doors,neutral
3972,sucks,negative
5683,the cast is really great,positive
2050,warm and cold,positive
6256,finesse at it's finest,positive
6518,the villain is almost like a combination,neutral
3339,hypnotic to watch,positive
5032,post apocalyptic earth never looked so good,positive
5906,very little for the brain all for the eyes,neutral
4083,never seen the original mad max movies and all of the above.,neutral
142,never heard of mad max series before,neutral
5588,chase sequences and aerobic stunts,neutral
2162,it makes sense that they recast,neutral
5080,truly a master of his art,neutral
4434,a searing historical biographical drama,positive
6123,"a tale of discovery, of transformation and above all",neutral
606,"this film was much expected, that is why is so disappointing",negative
6144,overblown,positive
2065,to help with the continuity.,neutral
1266,as a die hard fan,positive
622,marries his now fully-matured filmmaking style,neutral
4262,no doubted the most original moviemaker of our time,positive
4049,neeson and fiennes have been lauded,positive
3052,twice what the original villains were,positive
7353,"I particularly remember my senses being assaulted by strident cords of music that would blare out with very little warning, and even less meaning.  ",negative
1598,master himself,positive
6956,The problem was the script.  ,negative
290,top quality,positive
2874,a platter,positive
6400,better script and story line,positive
6356,ufc gorilla,neutral
679,intense and colorful action scenes with excellent effects,positive
3926,this movie is another masterpiece,positive
4145,the actors did there best to keep the story going.,positive
4095,one of the best movie experiences i ever had.,positive
7551,This is just a great movie.  ,positive
4696,making it feel new,positive
5263,all beyond perfection,positive
2127,to destroy the whole existence of life,neutral
3607,horror,neutral
6733,he knows what's going on,neutral
3770,outstanding as a oskar schindler,positive
7007,"It is an hour and half waste of time, following a bunch of very pretty high schoolers whine and cry about life.  ",negative
3146,liam neeson should have won for best actor,neutral
769,religious nutters he thought would take over the world,neutral
6675,"it try to give to a new generation of audience the same strong, crazy",positive
1105,spielberg has never been better.,positive
2204,magnificent,positive
2291,ralph fiennes and ben kingsley really deserved an oscar,positive
1427,"""the power lies in the ability to pardon""",neutral
748,great movies,positive
3329,no other director could have attempted such a subject and succeeded.,positive
2233,way higher,negative
6584,the cradle based on historical details,neutral
4735,spielberg's greatest achievement,positive
3986,incredible vehicles,positive
5785,tight action sequences,positive
5329,charming and on point,positive
907,outstanding,positive
3439,the oscar eluded master filmmaking,neutral
4098,almost unanimously positive reviews,positive
4941,idiotic drums,negative
2457,it is confusing,negative
1841,ripping thru the desert on hill climbers,neutral
5608,steven really went to bat for this one.,positive
7834,"At a time when it seems that film animation has been dominated by Disney/Pixar's CGI masterpieces, it is both refreshing and comforting to know that Miyazaki is still relying on traditional hand-drawn animation to tell his charming and enchanting stories.  ",positive
7608,"Tom Wilkinson's character is a man who is not prepared for the ordeal that is about to begin, but he takes the matter in hand as the story progresses, and this great actor gives a performance that makes you feel the character's anguish and suffering.  ",positive
380,funny and awkward,positive
4026,"it's worse than that, but not the worst.",neutral
4797,imagery,neutral
5418,leo didn't perform in this one...,negative
7488,"It's as continuously beautiful to look at as a Bertolucci, but the relationships here are more convincing and the narrative more engaging than some of that master's work.  ",positive
7148,And don't even get me started on the jerky camerawork.  ,negative
2005,he's trying to cosplay yoda from star wars,neutral
1835,nothing about acting,negative
4832,it really is a feast for your eyes,positive
4963,isn't horrendously mawkish,negative
3177,well directed,positive
6217,"fans of mind-bending, time-based narratives",neutral
2486,most inspiring films,positive
4587,fantastic entertainment value of watching this crazy thrill ride,positive
5319,please watch the original movies,neutral
1899,cruel commander,neutral
3406,playing schindler had the best male performance,positive
499,performances,neutral
3430,powerful presence as the major villain,positive
4345,just might achieve a new standard for non-stop action & stunt work,positive
3443,arty cinematography,neutral
821,sadistic,neutral
4055,makes you think that you can't be fooled,negative
7424,The best example of how dumb the writing is when it's established that you can turn the zombie-students back into humans by removing a necklace containing a piece of the meteorite.  ,negative
4892,well-edited action scenes,positive
2600,powerful and engaging,positive
6507,strong performance,positive
7097,The character developments also lacked in depth.  ,negative
2487,never overdone,positive
2889,very simple,negative
4856,"i found it very good, marvelous ending",positive
3152,genuinely a remarkable experience,positive
4154,read wikipedia about how radiation works.,neutral
159,remembrance i take picture with him,neutral
5038,"well written, and downright entertaining",positive
1629,references,neutral
5868,"grizzled, bitter",negative
828,tighter editing,negative
6335,impeccably shot,positive
7726,"The result is a powerhouse achievement, made more timely now perhaps because of our culture's disturbing fascination with celebrity, and it's distorted interpretations of fame.  ",positive
3772,enjoy listening to it,positive
4400,dumb,negative
3927,better than the mel gibson films,neutral
693,good looks,positive
1717,has created a film that will remain with us forever,positive
6492,eye candy for hetero men,negative
5577,"barren, apocalyptic",neutral
2521,had much to learn about its story.,positive
4974,if you are able to,neutral
123,adds to the sad situation,negative
7332,I was deeply impressed with the character he played.  ,positive
6797,plot and character development,neutral
1627,he hardly speaks,negative
444,in a class of its own,neutral
1578,overwhelming and confusing,negative
341,hoyte van hoytema,positive
1850,a decent actor but does not have the imposing and threatening presence of mel gibson,neutral
2530,thinking you are in the room with them,neutral
5902,she is fine,positive
1393,please let this be the last mad max,negative
5085,very disappointed,negative
3829,all perfect,positive
5960,fight scenes aren't always well-defined,negative
5809,sensational + believable,positive
2066,adding to its art,neutral
5362,it is a must see,positive
517,if you want a movie that is brainless entertainment with mediocre action,neutral
4064,it was presented in a very tedious way,negative
4327,slick cinematography and editing,positive
3636,attend workshops,neutral
5924,insomnia,neutral
7533,"Speaking of the music, it is unbearably predictably and kitchy.  ",negative
2754,direction & scripting are all superb,positive
327,plays the lead ex cia agent now world saving secret agent guy,neutral
2606,this is one of liams best roles,positive
5190,overly confusing and complicated,negative
4461,george miller spent 17 years to work on a script for fury road,positive
1579,"total distress, desperation and hope",negative
6616,brilliant example of visual storytelling at its best,positive
3590,seat,neutral
7561,Well... Just if you keep thinking how bad it is.  ,negative
6728,doesn't make any sort of sense at all,negative
4595,the background music was so loud,negative
7072,"It probably would have been better if the director hadn't spent most of the movie showcasing his own art work, which really isn't that noteworthy.  ",negative
1557,sees a little girl in pink dress,neutral
3817,nanny,neutral
1988,fantastic score that touches your heart,positive
7074,Jamie Foxx absolutely IS Ray Charles.  ,positive
3723,visual rock video feel,positive
984,i love nolan's work,positive
1694,actually be fired,neutral
4642,not for people without brain),neutral
1338,amazing stunts and driving scenes,positive
3771,all the cast is brilliant,positive
4679,in my history class,neutral
2742,disappointed,negative
5832,it was a masterpiece,positive
5659,voted 5 or 6 out of 10,neutral
7422,"Let's start with all the problemsÂ—the acting, especially from the lead professor, was very, very bad.  ",negative
813,direction,neutral
3711,tom running from a bunch of guys on weird cars,neutral
1871,the aerial cinematography around these cats was special,positive
4873,black and white color,neutral
385,they are too complicated,negative
6631,this is truly one of spielberg's best works of art,positive
4808,story telling ability,neutral
2622,not somehow showing him to be about 4 feet something 'tall',neutral
1234,talk believably,neutral
3195,the same goes with all the characters really,neutral
1334,a classic,positive
1802,realistic,positive
4658,schindler's jewish accountant (and conscience),neutral
1549,standout performance,positive
4550,120 minutes,neutral
2520,in superb detail,positive
6399,pre-pubescent rampage,negative
3954,no time is wasted,positive
3378,hood ornament,neutral
5632,great together,positive
1451,cult classics,positive
5628,a film where you win and lose,neutral
2814,minimal,negative
1449,excellent actors,positive
3722,"remember that tear when he finally decides to ""have that drink""",neutral
1282,feels like perfection,positive
6905,"The very idea of it was lame - take a minor character from a mediocre PG-13 film, and make a complete non-sequel while changing its tone to a PG-rated family movie.  ",negative
2953,nice action for people that love action movies,positive
7358,See it.  ,positive
3448,watched a real movie,neutral
1516,wonderful 3d special effects,positive
5749,courage and heroism to overcome it,neutral
5205,the movie is too good,positive
6409,the actor are talented,positive
3124,bad choreography,negative
6659,wrong,negative
1313,3.9 score makes it worse,negative
3079,the practical effects are astounding,positive
496,a believable back-story of how the world turned to dust,neutral
6624,not that i'm complaining because it's still a great film,neutral
6212,daring,positive
5343,good job,positive
3994,best writing,positive
5283,soundtrack of john williams which is another aspect of the film that is beautifully done,positive
3706,strange sound bites,negative
4101,bit too loud in volume levels,negative
5305,fill in all respects the semblance of emptiness,neutral
5366,some similarity to his older movies blended together,neutral
890,perfectly chosen to play this role.,positive
1382,more than amazing,positive
827,pretty corny,negative
4023,power-packed road warrior sequences,positive
1066,liam neeson ends the movie,neutral
856,"america is not noted for its painters, sculptors, music, or cuisine",negative
4193,a movie,neutral
7225,This is one of the best movies out there that shows such strong sibling bond for each other.  ,positive
3364,smashingly successful,positive
1739,all the practical effects,neutral
6560,on his own,neutral
1408,2 hour adventure ride,positive
5254,you can't help but fall in love with the character,positive
5018,he was up against tom hanks,neutral
5542,"stunning to look at, excellently written and very well directed",positive
1632,"dark, grainy, fuzzy.",negative
3905,fitting music,positive
7319,"I wasn't expecting Oscar material, but this?  ",negative
7191,It is not just a cult... it is a cult CLASSIC.  ,positive
1919,overpowering performance,positive
4955,very realistic and breadth taking,positive
2793,at the expected low level,negative
6221,spielberg exposes enough of the horror,neutral
7008,"You can't relate with them, hell you barely can understand them.  ",negative
1173,used not only in the scene shown in the trailer,neutral
3716,not bored,positive
1705,finest film,positive
7349,"This movie contained an all-star cast, and what I loved the most was that it opened my eyes to see other actors who I haven't seen before.  ",positive
6569,the execution of the movie is fantastic,neutral
7177,This is such a fun and funny movie.  ,positive
3585,it has an average rating of 8.1,neutral
7076,"He owns the film, just as Spacek owned ""Coal Miner's Daughter"" and Quaid owned ""Great Balls of Fire.  ",positive
4435,"saved the lives of more than 1,100 jews from death",neutral
7777,"The acting is like watching wooden puppets moving around and reading from a book, that's how bad it is.  ",negative
1275,glory,positive
3140,gave the most beautiful sound-track,positive
2875,mind-blowingly good,positive
6445,don't waste your time on this dross!,negative
1679,"some of the best, if not the best, i have ever seen",positive
4772,picture,neutral
4411,kept my interest,positive
6630,dominates most of the screen,positive
4284,succinct,negative
5122,splice a random 2 hours of carnage together,neutral
1083,cinematic styling,neutral
1495,played in it,neutral
3374,tears,neutral
4490,another way of teaching people abou that period of time,neutral
4242,dusty and pasty faces,neutral
6077,he should stick to family movies,negative
6354,mel gibson chose not to repeat his role as mad max.,neutral
3100,great and sounds amazing,positive
2666,not a film for young kids,neutral
7858,It looked like a wonderful story.  ,positive
5843,what the producers were thinking,neutral
822,mind boggeling,positive
22,top notch,positive
3454,the direction,neutral
77,casted beautifully in their roles,positive
3674,more enchanting,positive
6433,time inversion aspect is extremely cool,positive
3707,none of them were bothered to be developed along the way.,negative
1799,his hidden attraction for his secretary,neutral
5348,a man who believes he can use a war that takes millions of lives,neutral
4317,surprisingly endearing,positive
5464,slowly go out of control,negative
1152,great picture and sound,positive
6177,"because it was on""",neutral
6762,i'm keeping my ideas this time.,neutral
6359,well edited,positive
7291,"I wish I could enter negative values, admins?  ",negative
6858,his heart and soul,positive
7522,"Macbeth (Jason Connery) moved me to tears with his final monolog (out brief candle, out)He gave the sphere of moral decay and dark forces a human face, which makes it the more interesting.  ",positive
6494,at his very best,positive
4578,through the telescope,neutral
4117,the sober reality of the final solution during world war ii,neutral
5065,spectacular and cleverly put together,positive
3023,extraordinary high score,negative
47,one of the best 4k transfers ive seen,positive
7183,All the characters in this film are tremendously well played.  ,positive
2307,he'll be remembered for generations to come,positive
3309,shine in their roles as,positive
4722,the music is banging awesome throughout,positive
7340,The dialogue is composed of things that make little sense.  ,negative
4914,a second viewing to be appreciated,neutral
322,absolutely made no sense,negative
6020,silly accents,negative
6903,It's PURE BRILLIANCE.  ,positive
4960,attract new fans to fall for his dork,positive
3482,you will see what an evil man he portrayed.,neutral
3474,schindler's list,positive
2472,hair and sand,neutral
6622,don't forget the pyrotechnics,neutral
4311,"bold, complex and mind blowing",positive
2748,better job acting,positive
4202,seldom to never,neutral
2525,great cinematography,positive
6593,terrible dialogue and just plain boring,negative
7508,The cast is always entertaining as usual.  ,positive
1958,spielberg does a dam go job,positive
319,personal and gripping,positive
2327,fury road,neutral
4501,nice and awesome,positive
3985,a two hour action masterpiece,positive
5595,worst movie,negative
4002,like he is a god,neutral
7202,By the time the pyromaniac waylaid the assistant I was bored and didn't care what happened next and so I switched off.  ,negative
3981,the movie he will look back on in years to come with the most pride,positive
473,a nightmare,negative
589,just as good as the movie.,positive
4562,worse than the original,negative
5978,nolan is the reason for the high ratings,positive
6609,schindler saved the most important commodity on earth- lives,neutral
960,"wonderful cinematography, editing superb",positive
4454,never do anything as good,neutral
6336,just a genius,positive
7401,the movie is littered with overt racial slurs towards the black cast members and in return the whites are depicted as morons and boobs.  ,negative
3205,the villain amon goeth,neutral
2788,his character madness,neutral
5578,cinematic,neutral
361,mediocrity level,neutral
309,too rush,negative
1730,what about mad max in the city?,neutral
6640,i love the action,positive
2546,confusing and disappointing,negative
3588,a legit superstar in waiting,positive
52,by comparison,neutral
1020,"taken ""shane"" as a model",neutral
1849,you are one of those zack snyder 300 and sucker punch facet fans,positive
4700,very little speech lines of all actors together,negative
3186,the director,neutral
617,strong female actor,positive
6260,music are done brilliantly,positive
486,the fight scenes are really good,positive
6531,great production,positive
5676,"not getting it""",negative
2345,spielberg shows his hollywood background by becoming overly sentimental,negative
3672,that is just plain wrong,negative
2798,more like bronson,neutral
5931,george miller could still deliver a movie worthy of max,neutral
3255,"depth, detail, and room to let your imagination fill in the blanks",positive
676,half the time,neutral
2036,nice,positive
1263,very highly,positive
2155,ridiculously loud,negative
4195,wonderful job,positive
6254,steven spielberg's vision,neutral
7080,Hitchcock is a great director.  ,positive
7282,Even worse than Ticker!  ,negative
5244,"having made a movie which shall remain in our hearts, minds and souls forever",positive
3046,every frame is perfect,positive
6450,fantastic camera-work,positive
3259,glossy and full of some great cinematography and superb stunts,positive
6253,performance and steven spielberg's vision,neutral
5321,wonderfully executed,positive
1718,all movie makers should take classes,neutral
7528,Also notable is John Bailey's fine crisp beautifully colored cinematography and the great production design & costumes by Eiko Ishioka who went on to do the memorable costumes for Coppola's Dracula for which she received a well deserved Oscar.  ,positive
59,used to get cheap labor from the jews for his factory,neutral
5016,it was used to follow a small girl,neutral
4161,brilliant performance,positive
1854,fell asleep,negative
6915,"I'm glad the film didn't go for the most obvious choice, as a lesser film certainly would have.  ",positive
5437,he is one of the only actors of the 21st century,neutral
5064,if you don't like instrumental music,neutral
4459,money is far not the most important thing in our life,neutral
4930,george miller botched the story completely,negative
6822,too loud and unpleasent,negative
4834,my only observation is with the sound,neutral
1022,match the perfection,positive
5313,furiosa is more mad,neutral
1172,no acting oscars,neutral
5898,a great and interesting world,positive
5409,staring at the camera 50% of her time on screen,neutral
7486,"A mature, subtle script that suggests and occasionally brings into dramatic focus the underlying tensions is well served by perfect performances (apart from the odd inappropriate smiling that Keira Knightley is prone to, though perhaps under direction this time as the other characters themselves often mention it).  ",positive
2123,engage you,positive
6280,in white n black,neutral
78,beautifully done,positive
6470,chris nolan has lost it - left half way through the music going backwards,negative
2095,a very personal movie,neutral
3925,this movie is another masterpiece from nolan.,positive
2760,the sound effects & the vehicle designs,neutral
68,massive fan,positive
798,excessively loud and persistent,negative
4162,equally as spectacular,positive
6006,one of the best ever heard,positive
7342,The directing is sloppy at best.  ,negative
335,lost all sense of taste and beauty,negative
4488,2\5 no joke,negative
6781,highly rewarding,positive
3812,the story was awesome and the acting fantastic,positive
3782,defo on visual effects for one,negative
1725,amazing action sequence after the other,positive
7122,It was so funny.  ,positive
6345,a great action director,positive
6925,I sat riveted to the TV screen.  ,positive
1781,it is his masterpiece,positive
6546,on a huge screen,neutral
5772,alright,positive
2046,you'll bite the dust behind the wheels,positive
2687,pumped full of steroids,positive
