,phrase,polarity
6977,"The movie was so boring, that I sometimes found myself occupied peaking in the paper instead of watching (never happened during a Columbo movie before!  ",negative
7457,"Being a 90's child, I truly enjoyed this show and I can proudly say that I enjoyed it big time and even more than the classical WB cartoons.  ",positive
853,cartoonish,neutral
2310,he was any more evil,neutral
810,"from the story, cinematography, acting and music",neutral
2587,oh boy,positive
833,somehow got lost in the style and stardom of the 80ties,negative
1087,"a ""shell of a man""",neutral
5816,a job in a war-related plant,neutral
5652,the dialogue is minimal,negative
1554,flawless,positive
4665,killed by the people of his own country,neutral
2213,phenomenal film,positive
6201,"fast pace action shots, close ups",positive
6152,i don't have any bad dreams about the brain.,neutral
1243,the one that touches that special place between your heart and soul,positive
5480,very reminiscent of his older movies,neutral
3338,inception a visual spectacle,positive
1159,disappointed me in being involved in this film.,positive
2444,water-tight plot,positive
2656,mad max is really a mad movie,positive
5170,my name is,neutral
6974,But in terms of the writing it's very fresh and bold.  ,positive
629,what it makes the movie worth a watch,positive
4803,the background music is indeed in many scenes too loud,negative
7861,"Unfortunately, any virtue in this film's production work was lost on a regrettable script.  ",negative
324,you sit up straight to better get your face rocked,neutral
803,its gonna take a while to recover from tenet,negative
2535,70mm,neutral
1638,number one,neutral
3704,they did a great job,positive
6435,educational and eye opening,positive
2801,this guy kept repeating how much he loved this drivel,positive
2267,different colors and different shots,neutral
1977,bot scores and movie trailer,neutral
5253,incredible job as neil,positive
292,powerful performance,positive
5688,"""i could have saven more""",neutral
979,poor action,negative
6969,Too politically correct.  ,negative
5257,the writing from steven zaillian,neutral
7209,is pretty funny.  ,positive
6698,in the same vein,neutral
6440,messing with time,neutral
6116,characters are not that strong some completely strange characters,negative
4541,there is no real usage of that technology,neutral
1068,"enough gas, water and bullets to last 10 lifetimes",neutral
3623,epic visuals and action sequences,positive
4227,"good performances by neeson,kingsley and especially as always",positive
1429,throttle,neutral
7117,The soundtrack sucked.  ,negative
6372,forgettable follow up to mel gibson,neutral
4281,he is indeed a great director.,positive
4203,music video,neutral
5206,complaining,negative
4291,"""the holocaust is about 6 million people who get killed.",neutral
2453,awesome visuals and a great sound,positive
644,super villain,neutral
3365,if you remember mad gibson,neutral
6084,see george miller's other movies,neutral
468,from aesthetics to adrenaline,neutral
5568,absolutely masterful,positive
4500,late night watch,neutral
2799,no!,negative
7564,") very bad performance plays Angela Bennett, a computer expert who is at home all the time.  ",negative
6890,This short film certainly pulls no punches.  ,negative
4852,biggest flops of all time given the budget,negative
2532,you will love the perfect picture quality,positive
1582,the direction is superb,positive
4858,acted better,positive
3012,made it so real,positive
5123,throw in 2 or 3 pretty girls not wearing much,neutral
146,think of game of thrones,neutral
5784,the psychotic camp commandant,neutral
6664,acting skills,neutral
2173,"michael caine says ""you will need better than brooks brothers to convince""",neutral
3420,never bother when you r watching schindler's list,neutral
461,fast pacing,positive
1713,in main role,neutral
1684,action,neutral
1013,more to set off schindler's good,neutral
5392,a story,neutral
5775,i would watch any of them again over this.,negative
1981,i thought it was called 'hitler' list,neutral
4200,brilliant acting from the lead actors does overshadow shoddy direction,positive
4382,second to none,neutral
4332,the movie just falls apart,negative
7536,Raw and sublimely moving.  ,positive
5510,purley,positive
7513,This movie does an excellent job of revealing the complexity of the task and the incredible challenges facing South Africa.  ,positive
6866,"Not sure who was more lost - the flat characters or the audience, nearly half of whom walked out.  ",negative
198,he succeeded.,neutral
1631,headache inducing color palette,negative
1268,hardy is perfect,positive
270,one of (if not) the greatest films ever made,negative
3137,pleasant surprise,positive
6471,backwards,neutral
6845,engine gets repaired,neutral
1146,very impressive,positive
7670,The only place good for this film is in the garbage.  ,negative
4978,just astounding,positive
4297,just superficial,negative
2242,desert,neutral
6078,trailers did not give us spoilers,positive
492,wrenching score,positive
4882,fantastic locations with great clothes and makeup,positive
657,excellent feel to the wild apocalypse,positive
6667,the imdb rating will definitely will drop,negative
7784,"Characters are one-dimensional, even the good guys and especially the bad guys.  ",negative
2058,playing the rhythm of american commercial genre films to the level of textbooks,positive
3225,pretty hot but super spoiler,positive
493,excellent photography,positive
3919,schindler was just brave enough to stand for what was right,neutral
1541,pretty wonky,negative
5442,great .,positive
7253,"Here, in The Wind and the Lion, we see a wonderful rendering of America's own Imperial age.  ",positive
4447,the protagonist,neutral
2145,a must-see,positive
1131,his amused sardonic turn,positive
3421,the best movie i've seen on the topic,positive
4979,the direction and screenplay is just astounding,positive
384,"""what the ...."" scenes and they are too complicated",negative
3808,some of the best i have seen,positive
7385,It is zillion times away from reality.  ,negative
6576,the action is pretty sweet,positive
482,steven spielberg's story telling is capturing.,positive
5980,furiosa somehow took that role,neutral
191,shine,positive
7583,"Top line: Don't waste your time and money on this one, its as bad as it comes.  ",negative
245,a waste of time,negative
7713,Lots of holes in the script.  ,negative
7086,There are the usual Hitchcock logic flaws.  ,negative
4172,wholesome flop,negative
5172,insane speed,positive
2531,getting jewish investors and workers to produce pots and pans in a factory,neutral
3030,fully on point,positive
2297,"steps to include in your story""",neutral
3489,score can bring anyone to tears,positive
1250,articulate,neutral
2853,kept my blood pumping up for more.,positive
3223,brilliant and in all its grandeur,positive
740,it's right up there with blade runner.,neutral
7544,The aerial scenes were well-done.  ,positive
6021,his bane was the worthers original granddad,neutral
7794,The movie is not completely perfect but 'Titta Di Girolamo' will stay with you for a long time after the vision of the movie.  ,positive
171,"make their best performances, and all deserved academy awards",positive
4827,she outshines tom hardy,positive
5246,"the best choice to be the new ""max""",positive
3564,not for the audience,negative
6163,the characters were very realistic,positive
7309,"Bela Lugosi was totally extraneous, intoning odd lines.  ",negative
3399,as a personal fan,neutral
33,even inception is like a joke,negative
4564,i consider myself quite fortunate that i have never had,neutral
5791,change the slide,neutral
6100,excellent portrayal,positive
2246,the movie is just too long,negative
2764,a bit better,positive
4349,the box set is the best,positive
5286,truly spielberg's best work with a very important lesson,positive
6216,provides the final glue,positive
2169,bending the laws of physics and cinema,positive
3543,black and white screenplay gives a much better appearance,positive
2391,great and funny,positive
1421,i would suggest to see it in imax as nolan intended,neutral
4132,close your eyes,neutral
1240,spielberg proved this is very possible,neutral
6269,nolan didn't try to make a character movie,neutral
1660,impressive cast,positive
6998,"All in all, a great disappointment.  ",negative
605,weak,negative
6279,this is really a great movie which is both sad and happy,positive
6369,one of the greatest men,neutral
2998,i would steer clear,negative
7746,I was bored throughout the whole damn thing.  ,negative
2986,drug induced wet dream,neutral
5019,he could have done better,negative
2034,giving this film your soul,positive
5176,offensive,neutral
3933,george miller delivers for sure.,positive
3389,amazing for jew's,neutral
1920,picking small points of detail,neutral
3551,epic looks beautiful,positive
3624,special effects and acting,neutral
1294,the plots are thin,negative
2698,charlize theron decide to go rebel,neutral
3490,bring anyone to tears,positive
837,where the hell was director who wanted to kiss everybody in the ass,negative
5649,it's christopher nolan,neutral
749,in full unrelenting detail,positive
372,the acting by liam neeson and ralph phiennes was amazing,positive
4114,his expressions,positive
774,heavyweight leads,neutral
4712,her hyper feminism,negative
4699,an important personality,neutral
7446,"However, here there was no decent acting, action or location work to balance things up.  ",negative
2517,attached to the front of that truck,neutral
723,the most brilliant idea,positive
7106,This would not even be good as a made for TV flick.  ,negative
5897,just went ahead to do it.,neutral
4697,it has some really nice,positive
5322,phenomenal and mind-bending world following a certain set of rules,positive
4212,great production values,positive
1381,the cinematography,neutral
7817,It presents a idyllic yet serious portrayal of the ups and downs of the characters lives.  ,positive
2497,blows to shreds,negative
3362,in my top two favorite movies,positive
6430,high light,positive
1454,plot mundane and uninteresting,negative
5131,i am therefore reconsidering the value of an imdb rating,neutral
383,frank presentation of the violence and indifference,neutral
7081,Ironically I mostly find his films a total waste of time to watch.  ,negative
6906,I wasn't the least bit interested.  ,negative
6571,spook,neutral
6392,they just didn't bother with,negative
1749,private party,neutral
3119,critical vision of the social structure in the 90's business environment,neutral
2954,atrocious,negative
5998,im a bit worried,negative
7027,Awful.  ,negative
4081,there for masterclass cast!,positive
7747,"The acting sucks, the music sucks, the script sucks, the pacing sucks, the special FX suck, the directing sucks... basically, this movie sucks.  ",negative
5984,you betcha sally baby,positive
794,not giving him the oscar,neutral
1819,"how much they have dedicated to the lore, costumes, etc.",neutral
4629,the music was good,positive
5718,"well executed, thrilling and a bit meta",positive
5814,spielberg was born to make this film,positive
7419,It's a shame to see good actors like Thomerson and James make a living in a mess like this.  ,negative
7143,If it was to turn my good day feeling into a night of disturbing memories than I guess he succeeded.  ,negative
2630,the action is where it truly shines,positive
5276,"amazing photography, cinematography, acting, directing, writing etc.",positive
1851,does not have the imposing and threatening presence,negative
7830,The incredible soundtrack truly captures the essence of the film.  ,positive
7534,Then the film just dropped the ball.  ,negative
2442,impeccable,positive
7729,The scripting of the subtle comedy is unmatched by any movie in recent years.  ,positive
2984,the car chases and costumes were essentially the bulk of appeal here.,neutral
1062,not fleshed out or explored at all.,neutral
1319,washington is out of his depth in the lead role,negative
966,fits perfectly,positive
7600,Nothing new there.  ,negative
2377,tour de force performances,positive
5451,after such a long wait tonget back to the cinema,positive
669,stole the show,positive
785,it's horrible terrifying what terror regime,neutral
1645,most bad-ass best picture nominee,positive
3202,never seen casablanca or citizen kane,neutral
1029,"nice cinematography, lots of loud explosions",positive
3006,the acting is solid and complete lack,positive
2577,complex plot,positive
3358,how often,neutral
4167,his scenes steal the screen,positive
1602,sound mixing and set pieces,neutral
4838,this movie take place in desert,neutral
399,please give up your seat for someone else,neutral
6673,"vernichtungslagers""",neutral
2402,remixing,negative
6136,in a christofer nolan way,neutral
5770,it becomes just another cliched foreign bad guy,negative
1215,i avoided spoilers,neutral
3156,"very shallow in plot, dialog, and character development",negative
6119,fills in the gaps of brilliant action packed acting,positive
7577,"Stanwyck and Morgan are perfectly cast in what is, in many ways, a modern equivalent of Dickens' Christmas Carol in its sensibility.  ",positive
7297,In short - this was a monumental waste of time and energy and I would not recommend anyone to EVER see this film.  ,negative
6110,i would suggest seeing them,positive
5008,awesome villain,positive
243,using liam neeson for rolling schindler's paper,neutral
3392,too quiet,negative
5400,#6 spot on the imdb top 250,neutral
6051,noise,negative
507,being a die hard,neutral
1703,challenges his audience,positive
2641,all budget,neutral
7628,I liked the way Dustin Hoffman's character was ready to do just about everything to stay with his son.  ,positive
3717,steven spielberg has his best masterpiece,positive
5405,filmmaker and has managed to once again improve upon his existing oeuvre,positive
4124,an action flick,positive
6538,the atmosphere just brings you into the movie,positive
2868,one of his best,positive
5914,short,negative
4241,best film of steven spieldberg's career,positive
4794,the film really shines when its action sequences take place,positive
6520,love a complex film,positive
7235,The jerky camera movements were also annoying.  ,negative
4128,spectacularly filmed,positive
3360,it doesn't hold a patch on the first mad max,neutral
4536,he freaked me out in this movie,positive
2102,this means war,neutral
7429,One of the most disappointing aspects is the lack of notable gore.  ,negative
3051,it is fun,positive
7453,"Even when the women finally show up, there is no sign of improvement; the most expected things happen and by the time the film is over, you might be far asleep.  ",negative
3424,blue ray,neutral
1498,exceptional experience,positive
3385,wizard of oz,neutral
5650,tom hardy would get little chance of portraying mad max,neutral
4853,fun you are going to like it and yet hate it,positive
4690,composition and performance betrayed his heart,neutral
1463,decent performance,positive
3491,second best,neutral
1788,it really deserved the best picture of the year,positive
6708,he wanted to crawl up on a cross and nail himself to it,neutral
5023,jews people put the stones in schindler's gravestone,negative
3297,when i was not professional cinema student,neutral
7196,"For those that haven't seen it, don't waste your time!  ",negative
2082,full on action packed movie right from start to finish,positive
1070,australian slang,neutral
359,the brilliants of film,positive
5992,pro tools,neutral
7243,This totally UNfunny movie is so over the top and pathetic and unrealistic that throughout the whole 90 minutes of utter torture I probably looked at my watch about 70000 times!  ,negative
5450,more ham,negative
6223,his incredible cinematography,positive
5826,surprised,neutral
2166,many handkerchiefs,neutral
6743,it was the reality,neutral
6024,try and repatriate the girls to his night club,neutral
58,giving the viewer an incredible vision,positive
6483,furiosas character wasn't so bad,neutral
5971,did not appeal to me as much as it did to several other film fans,negative
7779,I saw this short film on HBO the other day and absolutely loved it.  ,positive
2756,the atmosphere catches you from the first moment on.,positive
3367,joins the top of the list,positive
110,the story line has issues,negative
2804,from the heart here and delivers his most accomplished film,positive
1653,acted by cast,neutral
1868,mad max movie,neutral
5230,fantastic john williams,positive
886,a psychopath,neutral
4120,he has captured the whole atmosphere of the place.,positive
2699,being a huge nolan fan,neutral
6373,forgettable follow up,neutral
3980,take a lot of strength,neutral
5415,dreadful story telling,negative
6711,great read,neutral
2957,there are others out there who did their part,positive
2802,they invest more in bribing people into saying this is good,negative
2950,destroying what could be possible vestiges of art,negative
7102,But what really made it unwatchable was the direction.  ,negative
2299,"very long, keeps your attention.",positive
414,"working side by side, making a great team",positive
7498,"I know that Jim O'Connor was very energetic and that nobody could be as much as him, but George was well dull.  ",negative
7118,The acting sucked.  ,negative
2355,gave the numbers that he had tattooed on his arm,neutral
3322,using the cinematic medium,neutral
3807,the best film in the mad max series.,positive
365,high skill,positive
2898,machine prints out a sci fi script,neutral
1312,men of honor,neutral
2918,slightly exaggerated,neutral
1942,on tv and the like,neutral
1825,visually a very brilliant movie,positive
4518,it makes you feel a little good,positive
1496,"it's delivered here, a lot",neutral
7362,"I found this move beautiful, enjoyable, and uplifting.  ",positive
2362,it's all about the action.,positive
391,little girl,neutral
2289,no shaky,positive
194,crisp,positive
71,the cast is amazing,positive
6093,schindler is a good man,neutral
6908,But it's just not funny.  ,negative
5120,to focus the public attention,neutral
1724,spielberg had a dramatic engine,positive
2642,cult follower,neutral
3947,heart breaking drama.,positive
5039,have fun with the movie,positive
3580,brilliant background score,positive
1823,written and directed,neutral
2374,i just hope charlize theron didn't cut her her,negative
495,it will not bore you for a second,positive
377,astonishing10/10,positive
4582,to cover the problems with a confused story,positive
6946,This if the first movie I've given a 10 to in years.  ,positive
5488,thoroughly enjoyable and entertaining,positive
2139,for the big fans,neutral
6332,tom hardy would of tried to put on more of an australian ascent,neutral
6590,"intense, really well done",positive
5582,explanation' video,neutral
3731,the whole setup,neutral
4090,watch the action scenes and and sound effects,neutral
3200,it also has some narrative heft and two terrific performances,positive
989,brillant,positive
1332,adds to the film's unreal authenticity,positive
2773,a unique voice,positive
7060,But this movie is definitely a below average rent.  ,negative
7579,The attractive set used throughout most of the film is an eye-pleasing gem.  ,positive
4949,that's not bad,neutral
5615,standard large screen,neutral
6081,a class,positive
3942,depicted clearly that thought differences almost accurately,neutral
7616,But I thought his acting was skilled.  ,positive
5441,he either beefs up or comes across less of a snowflake,neutral
1569,very good actors,positive
5225,the effects and editing are so good,positive
5292,on all cylinders,neutral
447,an oscar nomination for best picture seems unlikely,neutral
3617,one just didn't care about the characters,negative
6339,good quality,positive
1239,you will not be disappointed,positive
6803,turn down the volume,negative
2342,sensational,positive
2511,enjoyed the action sequences and assumed that it all made sense to someone,positive
4439,the length is kinda dumb,negative
5527,fiddling with the keys of the jews,neutral
5622,sees the little girls pink coat in color was so well shot,positive
1816,humorous,positive
2120,16 yo stoner grandson's script,negative
7626,It's still wild stuff though and is highly recommended to fans of giallo cinema.  ,positive
2826,low point,negative
6970,Very disappointing.  ,negative
3427,we're given no reason to care for the main cast,negative
3334,the action was not what i'm interested in,negative
6684,best movie of the year,positive
1613,balancing both.,positive
6613,a absolute legend,positive
172,all deserved academy awards,positive
7112,"Yet, I enjoy watching it.  ",positive
4441,made,neutral
3599,sheer greatness that this film has achieved.,positive
3090,everyone is cast well,positive
7667,Star Trek V The final Frontier is the worst in the series.  ,negative
2396,absolutely grabbed me in every way,positive
306,moving picture show,neutral
2872,unreasonable,negative
5422,2.5/10 for cinematography and effects,negative
4992,if you didn't learn from those 4001 holocaust films,neutral
260,the war boy,neutral
2092,decent fitting well wide desert setting,neutral
5014,silly,negative
4732,he missed the pleasure,neutral
5427,behind the camera,neutral
795,moody business man who most important aim is money,neutral
408,audible,neutral
5768,where going after that.,neutral
5948,i would have preferred a little more time spent on characters's interactions,neutral
4826,he does what is said on the tin,neutral
2328,condensed in this sentence,neutral
1497,modern entertainment,neutral
5341,upstaged,positive
6475,more than i could even imagine,positive
5429,"the story line is well, not strong",negative
1055,sadly lacking,negative
3301,beautifully made in the action sequences and the storyline.,positive
7467,I saw this movie and I thought this is a stupid movie.  ,negative
6349,artistic and commercial success,positive
7059,But other than that the movie seemed to drag and the heroes didn't really work for their freedom.  ,negative
5301,the plot does not make any effort to make it less complex,negative
10,zillions of dollars bigger budget ,neutral
1346,went from using jews in his factory to saving them,neutral
6920,"But I recommend waiting for their future efforts, let this one go.  ",negative
7552,10 out of 10 stars.  ,positive
5417,does it very well,positive
7184,And I really did find them funny.  ,positive
3952,in order to save his wives,neutral
4134,great as oskar schindler and itzhak stern,positive
6647,beyond me and probably beyond others,neutral
1458,the second act where most of the characters are introduced,neutral
4925,oskar schindler,neutral
427,amazing costumes and an overall powerful acting,positive
3043,the story and plot is excellent,positive
7722,"In short, don't bother with this movie.  ",negative
6993,It rocked my world and is certainly a must see for anyone with no social or physical outlets.  ,positive
4173,amazing and jaw dropping,positive
3806,charlize and nicholas' characters,neutral
3143,it was good to see hugh keays-byrne playing the bad guy,positive
3848,a tearjerker,neutral
7701,Lot of holes in the plot: there's nothing about how he became the emperor; nothing about where he spend 20 years between his childhood and mature age.  ,negative
7257,"I think it was Robert Ryans best film, because he portrayed someone like my father, and he was a schizophrenic in real life,(my father) although he never murdered anyone but was affected more so during the second world war which made him worse.  ",positive
2611,difficult to make out some of the dialogue.,negative
4194,a movie that should be seen,neutral
1260,wickedly brilliant film-noir classic,positive
873,the character with the most development,neutral
4588,turns it on its head,neutral
2860,surpassed his jurassic park stage,positive
6314,great use of practical effects,positive
708,cgi added in the mix,neutral
5165,my congratulations to one of the best cinema performers,positive
4782,the lead,neutral
4994,my 2 favourite nolan films before,neutral
6127,beat you up ten times,neutral
3167,never feels intrusive,positive
4478,under a mask,neutral
305,a real live portrait,neutral
5738,"johnny got his gun"" is still #1 for worst",negative
6171,adding in small figures and things to make you stop and think what they mean,neutral
7485,"This is a masterful piece of film-making, with many themes simmering and occasionally boiling over in this warts and all study of the poet's bohemian, self-indulgent wartime years that span the aerial bombardments of London and the outward tranquillity of a Welsh coastal retreat - the borderlines between friendship, lust and love, dedication to art and experience versus practical concerns, jealousy, rivalry, cowardice and egotism versus heroism and self-sacrifice and more.  ",positive
6671,the girl caught in the crossfire was spot on bond,neutral
5621,the brutal officer is theatrical,neutral
663,the movie was amazing,positive
5572,from action to girls,neutral
6474,"sets out to escape his regime, taking with her all his wives",neutral
7052,"Yes, it's that bad.  ",negative
7070,I really don't see how anyone could enjoy this movie.  ,negative
2331,it was not a abram tank or t-90 tank,neutral
7589,"Seriously, it's not worth wasting your, or your kid's time on.  ",negative
5903,it has a large wonderful cast,positive
5888,clean water,neutral
6707,no screen presence or charisma,negative
2650,better cast,positive
3408,had the best female performances,positive
4891,insanely intricate,positive
4704,the film would not contain furiosa's name being the lead character,neutral
7318,Not even good for camp value!  ,negative
5028,shot almost entirely in black and white,neutral
877,cool,positive
5592,"he promises the jews to give them money, food and water",neutral
5530,even better,positive
7620,Nine out of ten for a truly lovely film.  ,positive
4110,very thin,negative
531,did nothing,negative
2662,very flat uncharismatic,negative
