,phrase,polarity
3656,a sport on everyone's watch list,positive
5778,no wonder,neutral
1118,a masterpiece,positive
4954,great visuals,positive
2274,as first time can't hold my emotions and tears,positive
425,a cia agent (john david washington) is recruited by a secret organization,neutral
2566,by having it flimed in black & white,neutral
286,visually stunning cinematography,positive
6179,does not do anything,negative
7795,I rate this movie 9/10.  ,positive
4401,action packed sequences,positive
1691,did a net horrible job,negative
1517,crisis of conscience,neutral
775,heavyweight leads with hardy and theron that elevate the movie slightly,positive
4715,makes a movie,negative
6271,an atmosphere like it,positive
903,the finished product speaks for itself,positive
5562,action scenes are done in a very good way,positive
1737,overly saturated dynamic range,negative
2099,absolutely badass,positive
5657,"if you've seen it, and think i'm crazy",neutral
2904,a kiddie movie,neutral
1693,i'll be very unhappy,neutral
2172,"""you will need better than brooks brothers to convince""",neutral
3164,reignites the once dead franchise.,positive
2542,punkish post-apocalyptic stylizing,negative
1755,sweet and all-american story,positive
5013,some of the scenes are amazing,positive
6939,"I wouldn't say they're worth 2 hours of your time, though.  ",negative
6350,music playing the entire time,neutral
710,to prepare our characters,neutral
1682,design is world classcinematography is very strong,positive
6287,the name was used,neutral
5544,with a finesse,positive
2719,"action.""",neutral
2593,extreme and true contrasts of events magnifies the emotional anguish,neutral
3398,hiding jews,neutral
3257,you won't understand the flash backs,neutral
2416,3 names so gotta be good,positive
3270,fury road will be immediately added to my collection,positive
5221,i've got disappointed it,negative
3768,"""masterpiece""",positive
3526,a testament to his vision and devotion to humanity,neutral
545,impressive performance,positive
1662,"use of color, practical effects, and every other aspect of production are incredible",positive
2796,he tries a little too hard to be,negative
1511,confused and tyrant spiral,neutral
5498,he need a nobel just for his brain,neutral
6007,one of my favourites,positive
6909,But even the talented Carrell can't save this.  ,negative
2052,behind the wheels in a riot for fuel and water,neutral
4059,the action completely made up for that.,neutral
5361,the schools in my district,neutral
783,colourised coat,neutral
4626,some expositivity,negative
1394,the film has been interpreted and characterized in front of the whole world,neutral
4777,spinach cinema,neutral
5848,a pile of dog excrement,negative
1776,treats his women brutally,neutral
2163,"text to voice"" wikipedia",neutral
3570,hopeful that schindler will save them,neutral
3995,extremely cheesy,negative
5387,to stand alone,neutral
7368,The rest of the cast also play well.  ,positive
1441,spectacular visuals,positive
6779,brightest light in those darkest years,positive
7206,It is a really good show to watch.  ,positive
2277,doesn't engage with the viewer at all,negative
1233,nolan-typical fantastic soundtrack,positive
3754,tenet's backbone,neutral
325,how well they were done,positive
7815,Both Rickman and Stowe play their roles to the hilt in this tale of a childrens' book writer who-- maybe?-- has written a subversive tract.  ,positive
1425,captures the emotions,neutral
6504,the visual effects was some of the best cg-graphics to date,positive
5149,it is very good the cast is very talented,positive
2594,very exceptional tough,positive
6231,if you like any nolan film you know what you're in for.,neutral
6117,to complete their journey,neutral
3688,some did not like worked well,positive
2922,one of the most powerful movies that i have ever seen,positive
6305,totally worth the price of the ticket,positive
2387,extremely well timed character development sequences,positive
745,buy jewish lives,neutral
4798,shocking and elaborate,positive
5063,acting is the perfect,positive
3849,the action was the only reason to watch this movie.,positive
4906,"there have always been, will always be more amon goethes",neutral
2993,great musical score,positive
6900,"As they say in Canada, This is the fun game, aye.  ",positive
2643,the ability to add even greater effects on screen,positive
1992,an excellent,positive
5585,lacking.,negative
1759,light weight,neutral
6328,pride parade,neutral
713,well done and intentionally over the top,positive
1659,neeson and fiennes were great,positive
154,visited his grave,neutral
5132,a greedy german businessman and his transformation as he becomes a humanitarian,neutral
6770,put your preconceptions about the director aside,neutral
5539,a three hour film that feels too short,positive
6401,confusion,negative
1783,it is still an excellent film,positive
5981,easily one of the best directors of all time,positive
1126,they were all equally amazing,positive
3175,impressive way,positive
5765,best director of all time,positive
5694,excellently,positive
2633,knowing that many people did not,neutral
6419,ralph fiennes being an excellent antagonist,positive
3677,badly mixed,negative
4036,saved 1.100 jews from the auschwitz concentration camp,neutral
7532,It is not good.  ,negative
5291,glued to the screen and on the edge of my seat,positive
5044,poor screenplay,negative
3062,"robbing, repectively",neutral
2761,vehicle designs,neutral
6828,a master of filmproductions,positive
7263,Non-linear narration thus many flashbacks and every part are articulated quite well.  ,positive
3116,australian novelist.,neutral
6293,just went to the theater,neutral
285,visually stunning,positive
563,one of the rare older series that actually deserves further exploration and expansion.,positive
6578,gave me goosebumps everywhere,positive
7557,This is one of Peter Watkins most accessible films.  ,positive
2936,haunts me,neutral
5293,the action sequences are superb,positive
6508,brilliant stunt sequences,positive
273,in the same breath,neutral
1228,outstanding performance,positive
4817,respects the audience,positive
2831,pulse-pounding,positive
2636,much talked-about,positive
6121,awsome,neutral
2747,fiennes did a better job acting,positive
1952,convincing portrayal of a man lost in his convictions,positive
5820,great support,positive
1722,quietly desperate jewish administrator,neutral
5060,my favourite,positive
7116,The cinematography-if it can be called that-sucked.  ,negative
4888,schindler's list is the best film,positive
3560,the acting is good,positive
484,burning and crazy,positive
4367,"liam neeson, ben kingsley, ralph fiennes",neutral
2218,lightening,positive
375,worth a watch,positive
3442,higher and elevated,negative
3136,is maybe one of his best!,positive
1758,honest in her part as an abused wife held to ransom,neutral
5631,phenomenal so good,positive
4413,one-arm,neutral
1100,"action per minute"" rule",neutral
1367,creepy,negative
2890,max is not the centre of the movie - furiosa is,neutral
2620,the cast are all so incredible,positive
3141,most beautiful,positive
261,starts a factory during the war using jews as slave labour,neutral
811,"cinematography, acting and music, this film gets it all right.",positive
3513,serious or not,neutral
134,he is the best on the desert.,positive
4146,christopher nolan makes a new movie attention needs to be paid,neutral
7494,His acting alongside Olivia De Havilland was brilliant and the ending was fantastic!  ,positive
5393,just for the sake of it and actually detract from the story line,negative
1640,it is being appreciated,neutral
6042,in almost every respect better than tenet,positive
1917,explode beautifully,positive
4199,nolan is showcasing his insecurities,negative
5249,good premise,positive
4035,"informs, shocks and ultimately illuminates the audience",positive
3461,impressive practical effects,positive
5203,i cried at schindler's humble heroism,positive
204,it does not diminish his drive,positive
780,it has also recieved its prices because of that.,neutral
5824,a great action movie with a spectacular technical department,positive
988,sappy,negative
779,a great movie,positive
6859,the presentation and subject matter overcomplicate things,negative
776,plays the protagonist,neutral
4543,in the end of movie,neutral
7641,Why was this film made?  ,negative
5236,the storyline was just bad,negative
1452,brilliant dialogues,positive
6703,the life,neutral
1584,academy award for best picture,neutral
1809,extraordinary job,positive
4381,melodramatic,negative
6512,one of best films you will see all year,positive
4366,"ralph fiennes, embeth davidtz.",neutral
738,amazing actress,positive
6270,amazingly high imdb ratings it enjoys,positive
7706,I'm still trying to get over how bad it was.  ,negative
3745,schindler's dissatisfaction jumped on the screen,neutral
2618,a master of the art,positive
5569,nolan discarded any set up or characters backgrounds,negative
2339,laying stones,neutral
4725,top performance,positive
7818,"Just whatever you do, avoid ""Groove"" as its the antithesis of all that is good about Human Traffic.  ",negative
221,this one is unfortunately a big mess,negative
2722,managed a uniform factory,neutral
3290,practically impossible,negative
3536,adds so much to the emotional depth of the movie,positive
2232,hardy's max doesn't talk that much,neutral
1774,"delivers a crucial intensity to the role, and draws the viewer into his world",positive
4251,waxing lyrical about it should take the time to wipe their collective chin,neutral
2158,fantastic and worth the time and money,positive
4998,annoyingly repetitive,negative
6840,well loved,positive
2766,two hours never stopping entertainment,positive
3956,overlong,negative
7123,"Overall, this movie was cheap trash.  ",negative
5851,if not steer well clear,negative
7575,The stories were as unbelievable as the actors.  ,negative
406,soundmixer,neutral
4030,"intrusive, at times, and you cannot understand half the dialogue",negative
4799,"story was good, cgi great",positive
1213,too repetitive and simplistic,negative
5653,strong atmosphere,positive
4869,he plays the same character,neutral
5081,the trailer reveals the stakes involved so i am not giving much away,neutral
5890,all the really extreme,neutral
2749,"refreshing, and the stunt-work is mind-boggling",positive
3180,totally blind,negative
131,fast paced dialogue was perfectly fit,positive
6207,confusingly on the edge of your seat,positive
1149,nothing can beat the background score,positive
969,an amazing story and a great documentation of how we can change as people,positive
2115,his masterpiece,positive
3958,the warriors,neutral
5444,you come close,neutral
7113,"Unfortunately, this is a bad movie that is just plain bad.  ",negative
2882,he really does his acting well,positive
6668,salvation's iconic jews,neutral
4956,gives a spectacular performance as oskar schindler,positive
3948,a potent combo,positive
6049,film-making at it's finest,positive
7531,"If you do watch it, however, there are small consolations: The actresses playing Anne's sisters each do a wonderful job with their roles.  ",positive
3788,best performance ever,positive
4939,car chase movie,neutral
951,well played,positive
5907,personal transformation,positive
256,poor special effects,negative
4180,this kind of formula,neutral
2101,gave the movie a sense of reality,neutral
3681,vividly and dramatically capture the essence of such a tragic time.,positive
2750,mind-boggling,positive
2136,more than 120 characters,neutral
3989,writing down,neutral
2901,kenneth branagh is a terrifying villiain,positive
7254,") What makes this story different are the terrific production values - faultless photography, composition and editing - the terrific casting - the underappreciated Brian Keith playing a bully Teddy - and vivid history.  ",positive
3936,the soundtrack is tensed,positive
7134,"The attention given to every character, and complex psychological portrayals, detailing loyalty, treachery, love, and hope, are tremendous.  ",positive
6796,"dialog, plot and character development",neutral
825,cynically selected,negative
1140,chocolate,neutral
733,exactly the film cinemas need right now.,positive
2363,"hey!""",neutral
1416,hoped it would end without me taking hearing damage,negative
5421,3 score is for the automotive engineering,positive
7570,One of the worst shows of all time.  ,negative
6982,"Then scene where they debated whether or not to sack the trumpeter (who falsely was accused for the murder) is pure horror, really stupid.  ",negative
3324,"all action, no content",neutral
7126,"***SPOILERS*** Whatever else can (or can't) be said about it, SURFACE is superbly crafted.  ",positive
3040,perfectly mounted,positive
320,incredible,positive
6316,excellent job as oskar schindler,positive
5740,one of the best film makers,positive
7359,"I really hope the team behind this movie makes more movies, and that they will continue to do so in their own, some kinda weird style.  ",positive
3830,depressing and sad,neutral
2048,badass tom hardy,positive
6170,i don't have any bad dreams about art or disability education,neutral
4080,hands-down,positive
7330,The only thing worse than Taylor's acting was Stanwyck's singing.  ,negative
2624,doesn't judge and doesn't need to,positive
469,adrenaline,neutral
5928,utter rubbish - crap plot,negative
718,excellent direction,positive
3735,"cinematography, editing",neutral
5651,a few pounds well spent,neutral
2212,it is completely lacking in imagination or vision,negative
6591,lacked character development and plot,negative
5204,guitar and the warboys,positive
437,branagh did well implementing it,neutral
2117,to name a few...,neutral
3763,the most selfish,neutral
5138,the dialogues might actually sound normal,neutral
1177,the final insult to injury,neutral
4652,excellent makeup and action sequences,positive
6233,awe-inspiring,positive
100,perfect,positive
7389,"Full of unconvincing cardboard characters it is blandly written by Edward Chodorov, who also produced, and is surprisingly directed by Jean Negulesco from whom one would expect a great deal more.  ",negative
2356,it's on netflix right now,neutral
4354,a very not so accurate movie,negative
4155,there more to the story you just have to pay attention,neutral
6525,i'd probably care more about the action.,neutral
5157,a female character similar to max,neutral
6380,they are pretty good,positive
2446,hit it out of the park,neutral
3951,mastery of ,positive
1036,it has the same score,neutral
4177,recommend this movie for any soul wondering whether they watch it or not,positive
1378,artistic,neutral
7489,The basic premise is wasted since it is sidelined by the inexplicable focus on the documentary crew.  ,negative
4993,the audio from the actors may need a fix,negative
1857,thank you to all cast,positive
5833,a movie that really grows on you,positive
2263,he has made some very terrible movies,negative
3535,just a background character,neutral
614,all of the actors deliver memorable if not exceptional performances,positive
7473,And the accents are absolutely abysmal!  ,negative
830,through the off road terrain,neutral
51,the expendables look like schindler's list by comparison,neutral
792,an absolute spectacle,positive
1891,out of luck,negative
4003,by the time you get bored,neutral
6556,thunderous,positive
6230,the saving grace of the movie,positive
1041,i didn't know there were other mad max films.,neutral
1388,one of the best directed films,positive
6807,terminator,neutral
1646,"miller tries his last film, with the last same tools",neutral
6220,after the earth became nuked,neutral
3785,to give it another go.,neutral
5973,wonderful reviews,positive
2495,saturated and unreal,negative
197,not about tom hardly,neutral
288,it was cool that a main character could have such little line in the movie,positive
1291,letting the viewer completely lose themselves in this experience,positive
7227,Everything from acting to cinematography was solid.  ,positive
2300,one of the absolutely greatest movies ever made,positive
7481,My rating: just 3 out of 10.  ,negative
5284,boring and linear,negative
3501,good casting call,positive
3594,"high-octane, pedal-to-the-metal",neutral
1641,self-parody,neutral
1081,ludwig has done a sufficient job,positive
658,like a puzzle,neutral
1122,sent off on a top-secret mission to save the world,neutral
7518,Excellent performance.  ,positive
1933,a soul searching work of art,positive
2336,good reviews,positive
3236,the nazis worked their way up,neutral
1186,excellent visuals and all star cast,positive
5561,tom hardy did absolutely amazing,positive
3939,just amazing,positive
2237,"the costumes, vehicles and sets are all excellent",positive
7127,The cinematography is simply stunning (to say the least) and the fx are nothing if not state-of-the-art.  ,positive
2649,dramatic,positive
1807,bludgeons and maxes out your nerves,negative
2217,irritation,negative
4779,wonderful as an evil man who became bored with evil,positive
2466,high quality and unique caliber of action,positive
4230,over-shadowed,negative
1787,feeling ecstatic,positive
4685,good directing,positive
168,a split personality of a film,neutral
3145,the actors were competent,positive
241,"giving us every detail of how he saved 1,100 jews from their dead",neutral
2200,he madly beats poor helen,neutral
1384,"thanks to the workers he not only employed, but saved",neutral
1845,mixed up and boosted,positive
369,phenomenal,positive
3514,two hours of non-stop action,positive
4666,beautifully reveal right after half way,positive
4805,a betrayal of mad max fans,negative
75,crying,neutral
947,i didn't know furiosa's story,neutral
4070,his hard work,neutral
2000,replaces some of the parts,neutral
3528,uses complicated words,neutral
7410,Clever and a real crowd-pleaser--this film still ranks among Mickey's best films even after 80 wonderful years.  ,positive
7515,Nothing short of magnificent photography/cinematography in this film.  ,positive
4607,effective jewish performances,positive
6307,"in the face of humanity, in the face of life",neutral
809,black and white movie,neutral
5526,sitting in the elegant piano of fiddling with the keys of the jews,neutral
3239,hard to understand the dialogue.,negative
70,the script is great,positive
83,struck gold,neutral
2983,the story was simple,neutral
6916,"In addition to having one of the most lovely songs ever written, French Cancan also boasts one of the cutest leading ladies ever to grace the screen.  ",positive
3698,poor,negative
6976,The directing and the cinematography aren't quite as good.  ,negative
2262,people is saying about the plot and the depth and things like that.,positive
2474,good casting,positive
6178,i just presumed that everyone else had too.,neutral
1635,non-stop,positive
6486,masterful photography,positive
2469,they are unlike anything you've seen before,positive
3650,uses limited screen-time & dialogue,positive
2675,hugh keay-byrne was decidedly bonkers,positive
1784,an excellent film and one of the top must-watch war films,positive
5002,from what i could get,neutral
1409,sit by the side and freak out every 34 minutes,neutral
141,"whites are pictured as fagots, insult valhalla",neutral
5864,amazing and unique,positive
7658,This mostly routine fact-based TV drama gets a boost from the fine performance by Cole.  ,positive
2962,effective,positive
5300,therapeutic for his mind,neutral
5875,best sound mixing,positive
4719,imdb needs to start removing the advertisers,negative
4517,photography,neutral
6937,"It crackles with an unpredictable, youthful energy - but honestly, i found it hard to follow and concentrate on it meanders so badly.  ",negative
1229,a semblance of plot to go with the violence,neutral
340,director of photography results in a reliably visually stunning film,positive
1125,one big action sequence,positive
4122,i did like the trucks,positive
4786,spielberg did not hold back on the horrors,positive
4392,deducting points,negative
2891,"good, sensible and going on a good pace",positive
5946,the makers of this just doesn't understand,negative
1746,high score,positive
6997,"This was a poor remake of ""My Best Friends Wedding"".  ",negative
4720,god for survivor's generations,neutral
3426,i specifically created an account,neutral
5611,charlize theron had the best performance,positive
5406,great action movie,positive
5983,it's not graphic enough,negative
6257,everything about this movie is finesse at it's finest,positive
1695,flawless film,positive
690,gives some classic air,positive
6267,you'r awesome,positive
5671,nolan has a complex story which in many ways like inception and memento,neutral
1236,unique story element allows them to get creative and add excitement,neutral
3946,takes over form old warlord,neutral
6108,looks at the ring on his finger,neutral
993,loud,negative
839,daring change,positive
6857,i seemed to see a silver lining in him,neutral
5229,the location looked more like a holiday camp,negative
2780,nothing new there.,negative
2295,all the water is gone,neutral
7173,I'm translating movies for a living and this is the first movie in my 5-year working experience that I found offensive to my intelligence.  ,negative
4309,no-one tells mad max what to do.,neutral
3021,artistic value,neutral
3357,large man is just a genius,positive
5559,anlatan harika bir,neutral
7470,"In conclusion, I will not bother with this movie because a volcano in Los Angeles is nothing but nonsense.  ",negative
398,music is so loud,negative
2730,if u can't make audience to understand it,negative
4867,"sharps up a complex,intriguing vision",positive
3888,a greatfilm maker,positive
3248,to find an equally bad ass woman character,neutral
3197,very cure and evil,neutral
732,like never before,positive
11,great acting and a good plot,positive
3407,best male performance,positive
1047,artful vehicles,positive
1674,"it was able to convey mood, emotion and a sense of the characters",negative
3862,1993 movie,neutral
949,almost a mockery,negative
5859,all around good guy,neutral
7275,A world better than 95% of the garbage in the theatres today.  ,positive
2956,simple-minded morality tales,neutral
5560,absolutely amazing,positive
431,"""i could have saved more""",neutral
6842,the tapestry attains completion and perfection,positive
4412,one of the best performance throughout his life,positive
4129,easy to follow,positive
5234,how good,positive
600,an emotionally shattering and gripping movie,positive
2571,stunt work,neutral
60,wonderfully written,positive
761,hollywood truly destroys its future,negative
6225,just and righteous man,neutral
3072,i recommend to be watched,positive
7804,The scenery that the two daughters paint and photograph are beautiful.  ,positive
7466,There is simply no excuse for something this poorly done.  ,negative
5445,on top form,positive
2371,it is very decent,positive
3419,it is more than enough,positive
2183,they were awe inspiring,neutral
2292,really deserved an oscar,positive
5075,showcasing the lack of compassion,neutral
6918,"On the negative, it's insipid enough to cause regret for another 2 hours of life wasted in front of the screen.  ",negative
7654,This is an extraordinary film.  ,positive
7423,The script is a big flawed mess.  ,negative
527,best comback,positive
6132,confusing mechanics,negative
5105,plays schindler excellently,positive
6374,csi on steroïds,neutral
786,some people need more than just that.,negative
5226,effects and editing are so good,positive
5492,a wasteland warlord who controls the water supply,neutral
1147,"very depressed, very desolate",neutral
7801,The two main characters may be two of the most believable children I ever saw put on screen.  ,positive
1069,to last 10 lifetimes,neutral
994,zombie movies,neutral
1034,the action is alright,neutral
2070,big chase scene,neutral
4389,the effects were impressive,positive
6094,absolutely brilliant,positive
4718,everyone's acting were very good,positive
1278,descriptive,neutral
1004,nolan tries to build a james bond movie with a science fiction element,neutral
1989,touches your heart,positive
7856,Fans of the genre will be in heaven.  ,positive
5725,biggest & and immersive screen,neutral
3579,dynamic pieces,negative
6579,"a must see movie, a must see in a cinema movie",positive
7571,The show would begin with smart ass ed comments to each other that would be totally off the wall and uncalled for.  ,negative
4357,loudest speaker,neutral
4682,just made a whole film of it,positive
4634,makes me think about the price of a human,neutral
413,working side by side,neutral
6180,great menacing villain,positive
321,personal top 10 list,positive
6048,to confuse all but those willing to return and mind map the plot,negative
12,good plot,positive
6064,invasive and electonic,negative
5849,it was an incredible sight,positive
7694,Trumbull on I LOVE LUCY).  ,positive
5093,overlong runtime,negative
7299,1/10 - and only because there is no setting for 0/10.  ,negative
2548,it has nothing to do with the original mad max (except name).,neutral
2067,unnoticeable and blended seamlessly with practical effects,positive
7749,This is probably one of the least effective and utterly unoriginal films I have ever seen in my entire life.  ,negative
3305,pure genius,positive
6134,the script,neutral
6898,"Actually, the graphics were good at the time.  ",positive
898,without dwelling on the details,neutral
3400,impressed with the look and role of tom hardy as max.,positive
659,it works so well,positive
1692,non-stop action,positive
7055,"Garbo, who showed right off the bat that her talents could carry over from the silent era (I wanted to see some of her silent work, but Netflix doesn't seem to be stocking them.  ",positive
4686,some speech is muffled,neutral
5995,rewarding character development and rich thematic content,positive
189,fantastic,positive
5792,fury road was anything but!,neutral
1225,brilliant) that provided a scrap of intelligent acting,positive
